9daaa7a0-6f91-4d39-97c6-f18f5e08740f	what do you want for dinner a hamburger or a peanut butter and jelly sandwich 	1	what do you want for dinner	a hamburger or a peanut butter and jelly sandwich	2020-02-07 19:43:16
9e3efef5-bfbf-47bc-93c3-6b5aa074d90f	what would you like for lunch pizza or pasta	1	what would you like for lunch	pizza or pasta	2019-11-18 20:43:56
9e6fa55c-926a-4b5a-a689-c140e7f87a23	do you want cheese or chocolate 	1	do you want	cheese or chocolate	2020-02-05 13:59:20
9e9f0aec-ee8e-4cba-94e1-5a7b76535487	do you want to go now or later 	1	do you want to go	now or later	2020-02-04 02:38:57
9f3fe995-f018-4077-a70d-804f46787e0a	do you want dinner 	0	do you want	dinner	2019-11-26 19:47:13
9f47ca7c-cb50-47be-87e9-632ba21be262	is this a question beep or bob 	1	""	is this a question beep or bob	2019-11-23 20:15:31
9f81b751-a34d-4c24-a7ed-620a1a5926d4	do you want cheese or bologna 	1	do you want	cheese or bologna	2020-02-12 19:34:23
9fbfc4c1-b05a-4d66-a1ec-d4b9a48aa5e6	whats your favorite food apples or carrots 	1	whats your favorite food	apples or carrots	2020-02-06 20:21:06
9fce0610-7357-4404-8733-0371a7798144	whats your favorite dog bulldog or husky 	1	whats your favorite dog	bulldog or husky	2019-11-23 20:20:12
9fe3f5a5-f1d3-41ac-98e0-435c3f3a2dcb	what would you like for lunch pizza or pasta 	1	what would you like for lunch	pizza or pasta	2020-01-20 18:47:03
a005b804-8786-49a0-b6d7-78b0b600eeb8	do you want to have ice cream or cocacola 	1	do you want to have	ice cream or cocacola	2020-01-31 13:54:43
a116162e-9a55-413e-bb4b-a6eca877cadc	what is the solution to 7  8 14 15 or 16 	1	what is the solution to 7	8 14 15 or 16	2020-02-04 02:41:43
a15720b4-47d4-43f4-bd24-76979cddd255	what do you want for dinner pizza or pasta 	1	what do you want for dinner	pizza or pasta	2020-02-08 16:15:02
a244e5d9-eb38-4145-97eb-1ffb01c3cb2c	what would you like for lunch pizza or pasta 	1	what would you like for lunch	pizza or pasta	2020-01-20 18:48:06
a30947ac-a944-402b-9bf4-bd625c5a690e	do you want ice cream chocolate for yogurt	0	do you want	ice cream chocolate for yogurt	2019-11-20 15:00:36
a36a8476-0359-4e03-9cd1-d9937d4c641d	do you have paws or hands 	1	""	do you have paws or hands	2020-02-12 22:12:34
a3ad7932-809f-47d3-bc7f-d0f509320133	where do you want to go to go school or the library	1	where do you want to go to go	school or the library	2019-12-10 22:20:35
a3b3597a-9f4f-436a-b04a-bd4c71e7693c	what do you want for lunch pizza or pasta 	1	what do you want for lunch	pizza or pasta	2020-02-04 20:31:07
a3c391b0-b75b-4761-a73f-449b4cef83a8	what do you want to drink beer or wine	1	what do you want	to drink beer or wine	2019-11-19 19:07:14
a3e2b9fc-50a1-4a70-93f7-211a76dd259e	what do you need to do this morning brush your teeth or go to the bathroom	1	what do you need to do this morning brush your teeth or go to the	bathroom	2020-02-18 20:06:34
a406e1fb-f734-4576-9ade-e5f2f15cfe1a	what would you like for dinner pizza or pasta	1	what would you like for dinner	pizza or pasta	2019-11-17 17:19:16
a4482a19-1597-428e-a63f-a77cd3b768c7	what do you want for dinner pizza or pasta 	1	what do you want for dinner	pizza or pasta	2020-02-08 17:21:07
a54c3971-5d69-4139-bb1c-16a4bc797527	what do you want to eat pizza pasta or sauce 	1	what do you want to eat	pizza pasta or sauce	2019-12-11 16:16:00
a61932df-a30e-4cf8-bf2b-05d86783b164	do you prefer up or down 	1	""	do you prefer up or down	2020-02-12 19:37:48
a62e4488-1362-4a03-84b3-ac338c738ea8	what do you want to eat pizza or pasta	1	what do you want	to eat pizza or pasta	2019-11-19 19:05:40
a651f85c-767f-4caa-bf1b-e3948b0c777a	where do you want to go school or the church 	1	where do you want to go	school or the church	2020-02-07 19:56:10
a6c171aa-3bce-424f-ab3b-334872d9b0f2	what do you want for lunch pizza or pasta 	1	what do you want for lunch	pizza or pasta	2020-02-07 16:58:24
a6ff843e-ede6-4ca1-8d5c-425bd1ba9ad3	what do you want for dinner pizza or pasta	1	what do you want for dinner	pizza or pasta	2020-02-11 02:39:40
a6ffe7b4-650e-4bc9-a843-e7862629f7fd	do you want to play with a ball or with a dog always a bike 	1	do you want to play	with a ball or with a dog always a bike	2020-01-30 20:33:07
a7b21a04-857d-41c5-9a5f-633c4169595e	how are you feeling today happy sad or angry 	1	how are you feeling today	happy sad or angry	2020-02-04 00:09:56
a8476e54-f616-4f70-a159-73e940c72dbc	what do you want for breakfast pizza or pasta 	1	what do you want for breakfast	pizza or pasta	2020-02-04 01:58:11
a87e8fc1-1849-41d2-b444-695a67dfc9dd	how do you want your eggs cooked fried or scrambled 	1	how do you want your eggs	cooked fried or scrambled	2020-01-31 19:54:10
a8815eb6-8946-4f08-b55a-6cf64d8e5778	what do you want for dinner pizza or pasta 	1	what do you want for dinner	pizza or pasta	2020-02-08 16:24:17
a88567d8-13f3-4666-a86f-30233218565f	what do you want for dinner a cheeseburger or pizza 	1	what do you want for dinner	a cheeseburger or pizza	2019-11-25 15:43:03
a8a95738-239d-4df9-96a1-1bc2bc103c66	what do you want for lunch pizza or pasta 	1	what do you want for lunch	pizza or pasta	2020-02-04 20:39:16
a91c3e8d-2d07-4ef0-aa35-060f6bc763e7	do you want a pasta or beans 	1	do you want	a pasta or beans	2020-01-31 14:00:02
a91d424e-4c9d-4c71-869e-ec108e8671e7	what time would you like to eat dinner 	0	what time would you like to eat	dinner	2020-01-18 19:43:24
a951d2e3-a757-4fea-b94f-7e4ff362e15e	what do you want for dinner pizza or pasta 	1	what do you want for dinner	pizza or pasta	2020-02-08 18:24:31
a9a5ed5e-5012-48c4-ade7-d3a8a7ea8d90	what would you like for lunch pizza or pasta 	1	what would you like for lunch	pizza or pasta	2020-02-04 02:24:48
aa68091f-e213-4aae-b9da-21319c201d9d	what would you like for lunch pizza or pasta	1	what would you like for lunch	pizza or pasta	2019-11-18 21:02:31
aa75b12c-bef3-4e11-8d46-51bb5d6dff0b	what do you want for dinner pizza or pasta 	1	what do you want for dinner	pizza or pasta	2020-02-07 16:44:54
ab0823d8-6856-4c0e-adb7-e6bb3e72f78e	what would you like for lunch pizza or pasta 	1	what would you like for lunch	pizza or pasta	2020-02-04 20:33:16
abfe31ee-d0a9-44d9-8ba1-32c5c00c2011	what do you want for dinner pizza or pasta	1	what do you want for dinner	pizza or pasta	2020-02-13 15:06:37
ac358a36-15cc-4e0a-9329-0df02ba899df	what would you like for dinner pizza or pasta	1	what would you like for dinner	pizza or pasta	2020-02-12 14:35:53
acfa0ef7-0b61-4036-9a3f-db342c457da6	what would you like for dinner pizza or pasta	1	what would you like for dinner	pizza or pasta	2020-01-05 14:10:27
ad7736c3-8127-457d-8c52-e88b895ee494	do you want to take a shower or wash your hands 	1	do you want to take	a shower or wash your hands	2020-01-30 20:40:24
ad967e13-c0be-434d-bf49-b44558c16ae4	what do you want to drink a margarita or coffee	1	what do you want	to drink a margarita or coffee	2019-11-19 16:15:08
ae3ebe2d-dd4a-448a-8b78-cf01da5b5a47	what do you want for dinner pizza or pasta 	1	what do you want for dinner	pizza or pasta	2020-02-08 16:18:20
ae417152-de3b-4781-ad5a-912ec0df554f	do you want the chicken fish or steak 	1	do you want	the chicken fish or steak	2020-01-31 14:00:55
af648e8c-9fba-4a42-8ce2-33ab327089d1	what do you like better cats or dogs	1	""	what do you like better cats or dogs	2020-02-11 19:15:35
aff7746e-f8d4-4060-8ca9-c4365888a835	whats your favorite time of the afternoon or the night 	1	whats your favorite time	of the afternoon or the night	2020-02-06 20:21:48
b02e5b12-beda-4c02-a076-1a5f19e3e519	what would you like for lunch hamburger or pizza 	1	what would you like for lunch	hamburger or pizza	2019-11-23 20:27:31
b040fd8d-7004-4401-874d-cecc362d8702	what would you like to have for lunch pizza or pasta 	1	what would you like to have for lunch	pizza or pasta	2020-02-04 02:26:16
b15b5d54-4faa-48fb-afbb-c3bc4fba70ec	is this book about a dog a cat or rabbit 	1	""	is this book about a dog a cat or rabbit	2020-01-30 20:27:23
b1b424dc-d164-4e7c-83c6-e1e25f0b63d5	what do you want for dessert cookies or brownies	1	what do you want for dessert	cookies or brownies	2019-11-19 17:52:56
b2a9fb58-4192-4a30-b135-ab9f36eeb837	do you want a chocolate or apples 	1	do you want	a chocolate or apples	2020-02-06 20:26:52
b2f0396b-ee0b-4294-8c89-9c09ce5df445	do you want milkshake water or soda 	1	do you want	milkshake water or soda	2020-02-12 19:35:27
b3172441-db65-4d5f-b046-950bce4463d0	do you prefer hot or cold weather 	1	""	do you prefer hot or cold weather	2020-02-03 02:00:02
b3af0869-b0e7-4577-88bc-2f786e5522b5	what do you want to drink coffee or tea	1	what do you want	to drink coffee or tea	2019-11-19 16:40:37
b445b923-7900-4e27-b32e-07b59a15db75	what would you like for dinner pizza or pasta	1	what would you like for dinner	pizza or pasta	2019-11-18 00:16:26
b47a51f9-438e-4d6a-82ab-1bce19760091	what do you want to drink bourbon or whiskey	1	what do you want to drink	bourbon or whiskey	2019-11-19 17:49:30
b495b28f-6b2f-467e-974b-b0f13d3eb2f9	where do you want to go school or the church	1	where do you want to go	school or the church	2020-02-11 19:49:52
b4a75ec9-df62-445e-afc2-14c7ef116a5a	do you want milk coffee or tea 	1	do you want	milk coffee or tea	2020-01-30 20:36:13
b4e13882-559f-4733-b8f0-82931384b636	what would you like for lunch pizza or pasta 	1	what would you like for lunch	pizza or pasta	2020-01-17 15:06:15
b526d79a-f20b-4840-b892-9f1b2a4d2bdd	who is your favorite artist taylor swift or ariana grande 	1	""	who is your favorite artist taylor swift or ariana grande	2020-01-18 19:39:41
b54f3a16-4326-4185-92c8-f3f081577563	do you want a hot dog or chocolate 	1	do you want	a hot dog or chocolate	2020-02-05 13:39:21
b55679fe-a603-4523-bd2c-f889b3706303	do you want coffee or milk 	1	do you want	coffee or milk	2020-02-05 13:40:30
b5871d1d-25c9-4ca5-8e02-87130bb987bc	do you want to study or sleep 	1	do you want to study	or sleep	2020-02-12 19:32:06
b60b9d42-3351-43c4-b99a-7a91d9d85734	what would you like for dinner pizza or pasta	1	what would you like for dinner	pizza or pasta	2019-11-20 18:56:30
b670a189-ceb8-4d46-800f-c674ae3f3b7e	what would you like for lunch pizza or pasta	1	what would you like for lunch	pizza or pasta	2019-11-18 21:25:38
b69d2358-1be1-47a1-ac28-f0ecd64b4e48	do you want a fanta or coke 	1	do you want	a fanta or coke	2020-02-12 19:37:14
b6b69246-7668-4f00-a1a9-7044516bd463	what do you want to drink coffee or tea	1	what do you want	to drink coffee or tea	2019-11-19 16:01:59
b70f98ff-1978-4880-9e54-90584373e0d2	do you want to shower or sleet 	1	do you want to shower	or sleet	2020-02-12 22:20:14
b8287ae5-d606-4ea3-915d-4e5ee92aba5e	whats your favorite piece of clothing pants or shirts 	1	whats your favorite piece	of clothing pants or shirts	2020-02-06 20:24:39
b8471ec8-1547-4b3a-873b-86678c0f03a1	what would you like for dinner pizza or pasta	1	what would you like for dinner	pizza or pasta	2019-11-18 00:22:05
b85d2a24-a871-4d33-8ff3-7b3381babcb1	what type of book do you want to read mystery or adventure	1	what type of book do you want to read	mystery or adventure	2020-02-14 16:17:19
b88fcf79-a09d-4336-a19e-86e66edbb304	what would you like for lunch pizza or pasta 	1	what would you like for lunch	pizza or pasta	2019-11-23 18:32:55
b8b3f725-443d-499b-b68e-78bb5084764c	do you want scrambled eggs or cheese 	1	do you want	scrambled eggs or cheese	2020-02-12 22:14:38
b8bfafab-b80b-4cf6-8d63-4d9a55f29568	do you like birds or dogs	1	""	do you like birds or dogs	2020-02-14 16:38:19
b9034895-b5cd-4026-bc7d-59715433acc1	what do you want for dinner baseball or badminton	1	what do you want for dinner	baseball or badminton	2020-02-17 02:30:19
b9210497-fa81-4911-b9fd-a2c9413fa5a6	what do you want for breakfast or pasta 	1	what do you want for breakfast	or pasta	2020-02-04 01:57:38
b93e8373-7dc0-405c-a13c-13b4a6aa9f77	do you want a milkshake or juice 	1	do you want	a milkshake or juice	2020-02-12 19:36:03
b9c27aa1-e860-490a-82d2-7e3535e0ac26	what do you want for lunch pizza or pasta 	1	what do you want for lunch	pizza or pasta	2020-02-07 16:26:17
ba090ad1-eed1-45c8-9470-dbc77d32eef6	when do you want to get o 	0	""	when do you want to get o	2020-02-04 02:53:33
ba275884-ae46-4b8a-bc51-1215b57a64d7	what do you want for lunch pizza or pasta 	1	what do you want for lunch	pizza or pasta	2020-01-20 18:41:30
ba80155b-3ab8-4f23-8eb4-46afdc447e63	what do you want for dinner pizza or pasta 	1	what do you want for dinner	pizza or pasta	2020-02-04 20:28:39
baefadf2-2167-4cbe-802d-257d492efe18	what would you like to have for lunch hamburgers or hotdogs 	1	what would you like to have for lunch	hamburgers or hotdogs	2020-01-18 20:09:26
bb36966a-5d2d-4577-bcaf-bffc49952668	what do you want to have for lunch pizza or pasta	1	what do you want to have for lunch	pizza or pasta	2020-02-17 02:22:21
bb38c1bb-086e-43b1-98d5-5ab103a5ad62	who is your favorite sibling your brother or sister	1	""	who is your favorite sibling your brother or sister	2020-02-18 20:17:42
bb5a9216-7f35-43fd-86b4-6fab7763aa9a	do you have paws or hands 	1	""	do you have paws or hands	2020-02-12 22:12:46
bc3b0404-cdaf-4051-b16b-5f2a9b81b7ec	what would you like for lunch pizza or pasta 	1	what would you like for lunch	pizza or pasta	2020-02-07 19:54:45
bc3f8ee3-5e71-48d1-913e-ea6ffc7450c1	what do you want for lunch pizza or pasta	1	what do you want for lunch	pizza or pasta	2020-02-17 19:00:13
bc4051ba-c3bf-44aa-a3ba-7c87d9e38522	whats your favorite carrots or apples 	1	whats your favorite carrots	or apples	2020-02-06 20:20:52
bc465b1f-7c76-492d-860e-10089a67bf43	would you like hot dogs hamburgers or pizza for lunch 	1	""	would you like hot dogs hamburgers or pizza for lunch	2020-02-08 23:01:00
bc9052ea-4dbd-4459-8fa6-2efc80a8756c	do you want to get high	0	do you want to get	high	2019-11-18 20:38:37
be0e77d0-6a1e-4b5f-b233-7ac038283edc	do you want to go to the park	0	do you want to go to the	park	2019-11-19 16:48:13
bf15c9ec-da2c-4564-80cd-2856f58145b1	are you bored or afraid 	1	are you	bored or afraid	2020-01-30 20:40:49
bf25fbf1-7486-404f-b4bf-09b1df9ce01c	when do you want to get a haircut today or tomorrow	1	""	when do you want to get a haircut today or tomorrow	2020-02-11 03:23:27
bf2c221f-f0e6-4747-babb-4d702bad89d9	what do you want to do for lunch get hot dogs hamburgers or pizza	1	what do you want to do for lunch	get hot dogs hamburgers or pizza	2020-02-11 19:19:09
bf5d2d15-8706-41fd-a575-8597588b521a	do you want to stay or leave 	1	do you want to stay	or leave	2020-02-12 19:33:15
bf8a2844-71b2-42a9-a502-fde227ef49a5	do you want to add or multiply the numbers	1	do you want to add	or multiply the numbers	2020-02-17 02:18:34
bf937cbb-1415-4d62-922c-7faeba4eeb4f	what is your favorite color red green or blue	1	what is your favorite color	red green or blue	2020-02-17 01:34:00
bfa2a914-b8e5-48b1-8d95-63162f8d5439	are you sad or angry 	1	are you	sad or angry	2020-02-12 19:33:29
bfbe6196-cf1e-4a90-adb9-0a22aecf2175	what would you like for dinner pizza or pasta	1	what would you like for dinner	pizza or pasta	2019-11-17 17:12:54
c05192a1-d5d4-4bc0-9cd1-1abd6be987f9	whats your favorite dog poodle or husky 	1	whats your favorite dog	poodle or husky	2019-11-23 20:21:02
c0a032cb-6c12-451b-b5cf-50974e965a24	whats your favorite dog corgi or husky 	1	whats your favorite dog	corgi or husky	2019-11-24 21:22:27
c1105b63-76bc-424d-8979-1367d6d54429	are you hungry or thirsty 	1	are you	hungry or thirsty	2020-02-12 19:31:21
c12c4124-3f0a-43c1-ae23-2163505a8069	what do you want for dinner pizza or pasta 	1	what do you want for dinner	pizza or pasta	2020-02-08 16:38:55
c1b90ed6-33b8-4c37-a6c1-3134be651379	would you rather only eat flowers or french fries	1	would you rather	only eat flowers or french fries	2019-11-17 16:56:25
c2a4c3d5-4a25-4130-8117-b834581b1791	what would you like for dinner pizza or pasta	1	what would you like for dinner	pizza or pasta	2019-11-18 00:23:31
c2b33f9c-cbd0-4a6f-b638-0197e3f045ca	do you want to put in chocolate yogurt ice cream or popsicle 	1	do you want to put	in chocolate yogurt ice cream or popsicle	2020-01-30 20:34:28
c2ce559f-22bd-4208-8984-8850feb96410	what do you want for dinner pizza or pasta 	1	what do you want for dinner	pizza or pasta	2020-02-10 19:57:36
c3000f42-8b9c-4df8-a6c0-9f5230488d13	do you want eggs and bacon or granola 	1	do you want	eggs and bacon or granola	2020-01-30 20:36:27
c355a7a6-97f6-4190-9223-1cc30ae06e1e	are you happy or sad 	1	are you	happy or sad	2020-02-12 22:15:52
c381b1c1-7f22-48a0-ae06-bb0b99764749	who benches more cole or zack 	1	who benches more	cole or zack	2020-02-04 20:22:26
c39531e5-103b-4098-8913-dbd388d96035	when do you want to get a haircut today or tomorrow	1	""	when do you want to get a haircut today or tomorrow	2020-02-11 19:50:39
c3a99dd6-77a9-450a-9ced-65ebdcd19eef	what do you want for lunch pizza or pasta 	1	what do you want for lunch	pizza or pasta	2020-01-17 19:19:54
c435c57e-aaf9-499f-9920-bb6e281c7b3b	is this a lion or a wolf 	1	""	is this a lion or a wolf	2020-01-30 20:28:01
c43b6d19-ddbd-4d4a-a03e-c1412c825001	what is 7  8 is it 14 15 or 16 	1	""	what is 7 8 is it 14 15 or 16	2020-02-07 19:47:59
c49b80fe-9231-4df0-874c-eafde530db77	do you want eggs and bacon or cheese 	1	do you want	eggs and bacon or cheese	2020-02-12 22:14:26
c52a1e86-d969-4b57-ac24-bd4dbc515023	do you want the pasta soup or salad 	1	do you want	the pasta soup or salad	2020-02-13 21:49:21
c5c47c93-3f22-424b-a2e9-84b8b66d6112	what do you want for lunch pizza or pasta 	1	what do you want for lunch	pizza or pasta	2019-12-11 14:23:10
c5c844ed-63de-47d4-a09f-eebbed32096c	where do you want to go school or the church	1	where do you want to go	school or the church	2020-02-17 19:21:20
c6261ed1-207c-4548-a0a0-ecb1e9e05e28	do you want to have pasta rice or beans 	1	do you want to have	pasta rice or beans	2020-01-31 13:58:37
c6891c32-2455-463c-a497-89a079f5b3e7	what would you like for lunch hamburger or pizza 	1	what would you like for lunch	hamburger or pizza	2019-11-23 20:34:00
c6ca1c42-1828-4aac-85ee-c93f05134cdc	do you want beer or wine 	1	do you want	beer or wine	2019-11-25 00:49:14
c738f70e-d8bd-48c7-bb54-a46d5167075b	do you prefer a cat or a dog 	1	""	do you prefer a cat or a dog	2020-01-30 20:31:03
c77a9d39-8778-499c-8a91-dfe6d23f182f	whats your favorite dog golden retriever or husky 	1	whats your favorite dog	golden retriever or husky	2019-11-23 20:12:13
c7dd6402-d711-49ac-8c22-96cc3b65ee4d	what would you like for lunch pizza or pasta 	1	what would you like for lunch	pizza or pasta	2020-02-09 17:42:45
c7e0a153-15c0-4869-93cf-d19fdaaa484a	do you want to see tv or watch a movie 	1	do you want to see	tv or watch a movie	2020-02-03 01:52:40
c86c01c7-e374-475f-8539-802b9b47a9c5	is rich a b**** or not	1	""	is rich a b**** or not	2020-02-17 02:50:56
c8749615-0577-405a-a137-bc75f4caff11	what do you want for lunch pizza or pasta 	1	what do you want for lunch	pizza or pasta	2020-01-17 18:59:37
c8fb3ed6-5e1f-4bc1-b6dc-7370d35a5ad1	do you want to go now or later	1	do you want to go	now or later	2020-02-11 19:17:42
c8fbccdd-e21f-4665-88b2-de1aad26120c	do you want a piece or corn 	1	do you want	a piece or corn	2020-02-03 01:53:22
c990f187-12b6-486a-9206-80ec49b94bd0	what do you want to do after school play video games or paint 	1	what do you want to do	after school play video games or paint	2020-02-07 19:59:13
c99431ab-9e11-4af7-90cf-5a0f12e95943	what time would you like to take a shower eight 830 or 9 	1	what time would you like to take	a shower eight 830 or 9	2020-02-04 02:38:43
c9b3ae4d-6d47-4e09-8031-407c5f0d0d7c	what do you want for dinner pizza or pasta 	1	what do you want for dinner	pizza or pasta	2020-02-06 02:41:56
c9db875e-d411-430e-a91a-ca1401045b68	what would you like for lunch hamburger or pizza 	1	what would you like for lunch	hamburger or pizza	2019-11-23 20:30:25
ca7808cb-acfc-4c3e-8046-8920b026c830	what do you want for lunch hot dogs hamburgers or pizza 	1	what do you want for lunch	hot dogs hamburgers or pizza	2020-02-04 00:13:23
cb4ab5ac-3b38-4a25-96a5-d6d9f239ba37	what do you want to wear to bed nook or jamies 	1	what do you want to wear to bed	nook or jamies	2019-11-25 15:51:13
cbdde106-13b4-4d3d-8abf-e8af09e2f8ce	whats your favorite dog golden retriever or husky 	1	whats your favorite dog	golden retriever or husky	2019-11-23 20:14:29
cbe711e5-562e-43f8-a6e1-9aae48a071d5	would you like to watch football at 5 pm or 10 pm 	1	would you like to watch	football at 5 pm or 10 pm	2020-01-18 19:44:38
cca76df0-c27c-4c24-b8f8-001a2d426a21	do you want the cocacola or sprite 	1	do you want	the cocacola or sprite	2020-02-12 19:37:23
cce438de-f323-4233-b47e-57ab16c2a19b	what time would you like to take a shower 8:00 8:30 or 9	1	what time would you like to take	a shower 8:00 8:30 or 9	2020-02-11 03:09:30
ce2b85fe-e14b-4c69-8dc9-711379203a8c	what would you like for dinner hot dogs or pizza	1	what would you like for dinner	hot dogs or pizza	2020-02-05 20:36:03
ce68e491-e33a-49bc-a680-2990ac3f9b1b	what would you like for lunch pizza or pasta 	1	what would you like for lunch	pizza or pasta	2020-01-28 20:11:47
ce977c6b-eaf2-4473-a903-29dab4dbd1f8	what would you like to have for lunch hamburgers or hotdogs	1	what would you like to have for lunch	hamburgers or hotdogs	2020-02-11 03:22:05
ce98f2fd-70a7-46a9-ad73-58d3a865fb1f	what would you like to have for lunch pizza pasta or a hamburger	1	what would you like to have for lunch	pizza pasta or a hamburger	2019-11-20 14:46:28
cf1a6207-ebdc-4b0a-8785-c69fdbc1693b	what would you like for dinner pizza or pasta	1	what would you like for dinner	pizza or pasta	2019-11-17 17:12:34
cf657719-6290-46df-af9f-96f39a46ac46	do you want grilled cheese or coffee 	1	do you want	grilled cheese or coffee	2020-02-05 14:41:53
d01d07af-3a06-44b1-835b-4952e4d7e3f2	what do you want to do after school play video games or paint	1	what do you want to do	after school play video games or paint	2020-02-17 02:24:36
d0824a57-a4d6-4731-bcb8-61d16d80e489	do you want a chocolate chip cookie or ice cream 	1	do you want	a chocolate chip cookie or ice cream	2020-02-03 01:51:24
d09cd840-dbb0-4af3-8da4-30d4c5bf7189	what do you want for dinner a hamburger or a peanut butter and jelly sandwich	1	what do you want for dinner	a hamburger or a peanut butter and jelly sandwich	2020-02-14 16:13:04
d0b2ac50-c35e-4fac-ac57-ee98dbd115fb	what would you like to have for lunch hamburgers or hotdogs	1	what would you like to have for lunch	hamburgers or hotdogs	2020-02-17 19:20:45
d0c0689e-1530-4efd-a66d-2dc7c546420a	do you want to come to your hair or change your diaper 	1	do you want to come to your	hair or change your diaper	2020-01-30 20:39:28
d10f6471-83b9-46dd-82b4-8edec02cc64c	what would you like for lunch pizza or pasta 	1	what would you like for lunch	pizza or pasta	2020-02-09 17:54:26
d164e501-cb1b-4d57-8f44-1bde8e4ea6ee	do you want pizza pasta or chicken 	1	do you want	pizza pasta or chicken	2020-01-30 20:08:14
d22ad812-48e8-4762-a1fd-80841df581ce	do you want a hamburger or a taco 	1	do you want	a hamburger or a taco	2020-01-31 13:56:24
d252181f-8d5b-4c58-8528-816cab9c593f	how do you like your turkey fried or baked 	1	how do you like your turkey	fried or baked	2019-11-26 19:53:57
d27052fa-39dc-4686-94bf-1582b1358a44	what do you want after school play video games or paint	1	what do you want	after school play video games or paint	2020-02-11 03:23:49
d30affe4-b893-4b18-9e39-5a7628217341	whats your favorite dog bowl dog or husky 	1	whats your favorite dog	bowl dog or husky	2019-11-23 20:19:40
d380b640-5355-486f-b533-89711ed23d38	do you want ketchup or mustard on your hot dog	1	do you want	ketchup or mustard on your hot dog	2020-02-17 02:17:30
d3dca96c-1fdc-4e64-80e9-7064b5228ed1	do you want pasta or beans 	1	do you want	pasta or beans	2020-02-05 14:14:19
d4896da5-c35a-4e90-b78b-e893dde843e6	what do you want for dessert cake or apple pie 	1	what do you want for dessert	cake or apple pie	2020-01-17 22:15:16
d4afcae9-f267-4a82-ab36-8363d308e1f0	what would you like as a snack ice cream chocolate or yogurt	1	""	what would you like as a snack ice cream chocolate or yogurt	2019-11-20 14:54:31
d5acfdbb-f67a-448e-99b6-5d7eea8297c6	what would you like for dinner pizza or pasta	1	what would you like for dinner	pizza or pasta	2020-01-05 13:36:07
d6186300-8d33-4a82-97f9-ffc309077c8d	do you want cookie or yogurt	1	do you want	cookie or yogurt	2019-11-18 07:13:33
d6406c22-a326-48f3-92f6-93fcd7a66357	do you want candy or lollipop 	1	do you want	candy or lollipop	2020-02-12 22:19:19
d67724e6-b5d6-4d10-b7b5-63060609ad2e	what do you want for dinner a hamburger or a peanut butter and jelly sandwich 	1	what do you want for dinner	a hamburger or a peanut butter and jelly sandwich	2020-02-04 02:39:12
d6d54e6e-1b58-491f-9000-b5ec2c3b8ccc	do you want a hamburger or hotdog 	1	do you want	a hamburger or hotdog	2020-01-31 13:57:33
d73fae14-4c90-4353-b95e-5cc93fec0bac	do you want cheese or chocolate 	1	do you want	cheese or chocolate	2020-02-05 14:00:14
d7bc9e2d-7dbb-4f2d-8f9c-f28731947910	how are you feeling today happy sad or angry	1	how are you feeling today	happy sad or angry	2020-02-17 19:07:23
d7d932ef-e8d0-4d14-8202-cc0f915c3c0c	what do you want for dinner roast beef pizza or hamburgers	1	what do you want for dinner	roast beef pizza or hamburgers	2019-12-10 22:16:17
d84529f4-c4a1-441d-8907-3fe464e6674b	what do you want to drink coffee or tea	1	what do you want	to drink coffee or tea	2019-11-19 16:40:14
d89814c2-367b-4c15-82b7-b16857604bfd	do you want pancakes or waffles or oatmeal 	1	do you want	pancakes or waffles or oatmeal	2020-02-12 22:17:42
d8bd3015-a8f8-445c-9e4c-ed27054d72e5	what do you need to do this morning brush your teeth or go to the bathroom	1	what do you need to do this morning brush your teeth or go to the	bathroom	2020-02-14 16:09:37
d8e5ce2c-abf4-427c-9ddc-e6479118b5de	are you hungry or thirsty 	1	are you	hungry or thirsty	2020-01-30 20:26:43
